{
  "analysis_release_id": "reliable_20260831_v3",
  "publication_policy": "Human-approved recommendations linked to the analytical release. Daily monitoring does not rewrite this file.",
  "recommendation_count": 3,
  "recommendations": [
    {
      "additional_data_needed": "Repair five response-timing anomalies, add owner-side Apple response records, and connect responses to later rating edits, reviewer follow-up, or support-resolution signals.",
      "decision_boundary": "The data supports an assessment of visible response quality. It does not prove that a customer noticed the repetition or that the responses changed public brand perception. Apple response practices cannot be compared until owner-side response data is available.",
      "display_order": 1,
      "evidence": [
        {
          "context": "Rolling-year Google developer responses",
          "display_order": 1,
          "evidence_class": "governed_metric",
          "evidence_id": "response_generic",
          "metric_label": "Generic or templated",
          "metric_value": "85 of 90"
        },
        {
          "context": "Responses with specific product context, explanation, instruction, or resolution",
          "display_order": 2,
          "evidence_class": "governed_metric",
          "evidence_id": "response_specific",
          "metric_label": "Issue-specific",
          "metric_value": "5 of 90"
        },
        {
          "context": "Responses that publicly communicate a fix or resolution",
          "display_order": 3,
          "evidence_class": "governed_metric",
          "evidence_id": "response_resolution",
          "metric_label": "Fix or resolution stated",
          "metric_value": "2 of 90"
        },
        {
          "context": "Based on 85 nonnegative response-timing records; five anomalies excluded",
          "display_order": 4,
          "evidence_class": "governed_metric",
          "evidence_id": "response_median_time",
          "metric_label": "Median valid response time",
          "metric_value": "4.4 days"
        }
      ],
      "evidence_status": {
        "code": "supported_finding",
        "label": "Supported finding about response quality; brand effect not yet measured"
      },
      "evidence_summary": "In the rolling-year Google data, 85 of 90 responses are generic or templated. Only five address the customer issue specifically, two communicate a fix or resolution, and none provide visible case or follow-up language.",
      "rationale": "Developer responses are part of the visible customer experience. They show both the reviewer and prospective customers whether Samsara understands the problem, takes ownership, and provides a useful path forward.",
      "recommendation_id": "public_developer_response_quality",
      "recommendation_name": "Make public developer responses more helpful and specific",
      "recommended_action": "Establish a response-quality playbook that preserves empathy while adding issue recognition, relevant guidance, a clear next step, ownership, and closure. Score response quality by customer issue, severity, response time, template reuse, and subsequent customer outcomes."
    },
    {
      "additional_data_needed": "Add country-specific sources, English, French, and Spanish language controls, translation validation, minimum sample thresholds, and local regulatory, rollout, and release context.",
      "decision_boundary": "The existing probes establish collection feasibility, not international findings. Storefront territory does not establish reviewer location, and raw country counts are not comparable without product and platform standardization.",
      "display_order": 2,
      "evidence": [
        {
          "context": "Rolling 365-day approved analysis population",
          "display_order": 1,
          "evidence_class": "governed_metric",
          "evidence_id": "governed_us",
          "metric_label": "Governed US corpus",
          "metric_value": "927 reviews"
        },
        {
          "context": "207 Driver and 15 Fleet; feasibility signal only",
          "display_order": 2,
          "evidence_class": "exploratory_probe",
          "evidence_id": "canada_probe",
          "metric_label": "Canada Apple probe",
          "metric_value": "222 reviews"
        },
        {
          "context": "4 Driver and 8 Fleet; insufficient for stable comparison",
          "display_order": 3,
          "evidence_class": "exploratory_probe",
          "evidence_id": "mexico_probe",
          "metric_label": "Mexico Apple probe",
          "metric_value": "12 reviews"
        },
        {
          "context": "Territory does not prove reviewer location",
          "display_order": 4,
          "evidence_class": "collection_limitation",
          "evidence_id": "territory_limit",
          "metric_label": "Location boundary",
          "metric_value": "Storefront only"
        }
      ],
      "evidence_status": {
        "code": "new_data_required",
        "label": "New data required; Canada is the strongest first collection market"
      },
      "evidence_summary": "The governed corpus contains 927 US reviews and no governed international comparison set. Earlier Apple probes found 207 Driver and 15 Fleet reviews in Canada, with much smaller samples in the United Kingdom and Mexico.",
      "rationale": "The current analysis describes US storefront feedback. A staged international benchmark would show which themes travel across markets and which may reflect local regulation, language, rollout, or workflow differences.",
      "recommendation_id": "multi_market_review_benchmark",
      "recommendation_name": "Establish a staged multi-market review benchmark",
      "recommended_action": "Extend governed collection to Canada first, then add Mexico and other markets as review volume permits. Compare themes within the same product, platform, language, and time period."
    },
    {
      "additional_data_needed": "Join the review signals to internal crash, performance, release, device, network, incident, and support data before assigning root cause or engineering scope.",
      "decision_boundary": "Public reviews can identify where reported experiences differ. They cannot establish that Android, iOS, or a specific code change caused the problem because reviewers are self-selected and platform populations differ.",
      "display_order": 3,
      "evidence": [
        {
          "context": "Share of improvement-signal reviews; 25 Android and 4 iOS records",
          "display_order": 1,
          "evidence_class": "governed_metric",
          "evidence_id": "fleet_access",
          "metric_label": "Fleet access, Android vs iOS",
          "metric_value": "35.2% vs 20.0%"
        },
        {
          "context": "Share of improvement-signal reviews; 74 Android and 19 iOS records",
          "display_order": 2,
          "evidence_class": "governed_metric",
          "evidence_id": "driver_stability",
          "metric_label": "Driver stability, Android vs iOS",
          "metric_value": "22.6% vs 17.4%"
        },
        {
          "context": "Share of improvement-signal reviews; 21 iOS and 46 Android records",
          "display_order": 3,
          "evidence_class": "governed_metric",
          "evidence_id": "driver_hos",
          "metric_label": "Driver HOS, iOS vs Android",
          "metric_value": "19.3% vs 14.0%"
        },
        {
          "context": "Android versus iOS share of improvement-signal reviews; raw all-review rates are 42.7% versus 20.0%",
          "display_order": 4,
          "evidence_class": "governed_metric",
          "evidence_id": "fleet_stability_mix",
          "metric_label": "Fleet stability after mix adjustment",
          "metric_value": "49.3% vs 45.0%"
        }
      ],
      "evidence_status": {
        "code": "supported_diagnostic",
        "label": "Supported diagnostic recommendation; internal product data required to determine cause"
      },
      "evidence_summary": "Fleet access and recovery is more Android-concentrated after adjustment. Driver app stability is directionally higher on Android, while Driver HOS integrity is higher on iOS. The large raw Fleet stability gap narrows substantially after controlling for review mix.",
      "rationale": "Several review patterns differ between Android and iOS after using product-specific denominators. These differences can focus technical investigation on the code paths, devices, versions, and workflows most likely to need attention.",
      "recommendation_id": "platform_specific_stability_investigations",
      "recommendation_name": "Open targeted platform-specific stability investigations",
      "recommended_action": "Review crash reports, application versions, operating-system versions, device models, release groups, network conditions, and support cases for the platform-skewed workflows."
    }
  ],
  "schema_version": "1.0"
}
